{
  "objects": [
    {
      "authority": {
        "owners": [
          "libre-ai/architecture"
        ],
        "path": "ecosystem/objects/bets/bun-fullstack.json"
      },
      "id": "urn:libre-ai:bet:bun-fullstack",
      "kind": "Bet",
      "name": "Bun fullstack pour les applications web",
      "provenance": {
        "authors": [
          "libre-ai"
        ],
        "createdAt": "2026-07-16T00:00:00Z",
        "reviewedAt": "2026-07-16T00:00:00Z"
      },
      "purpose": "Réduire la fragmentation de la stack web et accélérer la livraison d’expériences IA-native.",
      "relationships": [
        {
          "status": "accepted",
          "target": "urn:libre-ai:decision:bun-react-rust-big-bang",
          "type": "implemented-by"
        }
      ],
      "schemaVersion": "libre-ai.knowledge-object.v1",
      "status": "accepted",
      "trust": "normative"
    },
    {
      "authority": {
        "owners": [
          "libre-ai/architecture"
        ],
        "path": "ecosystem/objects/bets/method-as-product-zero.json"
      },
      "id": "urn:libre-ai:bet:method-as-product-zero",
      "kind": "Bet",
      "name": "Le produit zéro est la méthode",
      "provenance": {
        "authors": [
          "libre-ai"
        ],
        "createdAt": "2026-07-19T00:00:00Z",
        "reviewedAt": "2026-07-19T00:00:00Z"
      },
      "purpose": "Invariant I-13, ratifié par ADR-0009 §1 : le produit premier n'est aucune application mais la méthode de gestion agentique d'une constellation — des boucles d'agents qui opèrent, maintiennent et améliorent la flotte sous des gates vérifiables, la touche humaine étant réduite aux invariants. Les applications sont à la fois des produits de plein droit et les bancs d'essai qui prouvent que la méthode fonctionne. Le pari est que cette inversion produit un avantage durable là où l'accumulation d'applications n'en produit pas.",
      "relationships": [
        {
          "status": "accepted",
          "target": "urn:libre-ai:decision:constellation-portfolio-and-method",
          "type": "implemented-by"
        },
        {
          "status": "accepted",
          "target": "urn:libre-ai:decision:wave-execution-decisions",
          "type": "implemented-by"
        }
      ],
      "schemaVersion": "libre-ai.knowledge-object.v1",
      "status": "accepted",
      "trust": "normative"
    },
    {
      "authority": {
        "owners": [
          "libre-ai/architecture"
        ],
        "path": "ecosystem/objects/capabilities/agent-contribution-provenance.json"
      },
      "id": "urn:libre-ai:capability:agent-contribution-provenance",
      "kind": "Capability",
      "name": "Provenance signée des contributions d'agents",
      "provenance": {
        "authors": [
          "libre-ai"
        ],
        "createdAt": "2026-07-25T00:00:00Z",
        "reviewedAt": "2026-07-25T00:00:00Z"
      },
      "purpose": "Lignage vérifiable de qui a produit quoi dans une chaîne agentique : identifiant d'agent, rôles tenus (auteur, exécutant, correcteur, éditeur), digest de contribution et références d'observation, le tout scellé en Ed25519 — signature asymétrique d'origine, à la différence du HMAC symétrique de l'enveloppe, parce qu'un tiers doit pouvoir vérifier sans détenir de secret. Digest préfixé en longueur, fail-closed sur altération ou mauvaise clé. Brique `packages/provenance`, contrat `contracts/schemas/agent-contributor-lineage.v1.schema.json`. La clé de production relève d'une cérémonie propriétaire distincte, la brique prenant la clé en paramètre.",
      "relationships": [
        {
          "status": "accepted",
          "target": "urn:libre-ai:decision:loop-security-kernel",
          "type": "governed-by"
        }
      ],
      "schemaVersion": "libre-ai.knowledge-object.v1",
      "status": "accepted",
      "trust": "reviewed"
    },
    {
      "authority": {
        "owners": [
          "libre-ai/architecture"
        ],
        "path": "ecosystem/objects/capabilities/contract-first-validation.json"
      },
      "id": "urn:libre-ai:capability:contract-first-validation",
      "kind": "Capability",
      "name": "Contrats canoniques et validateurs de frontière générés",
      "provenance": {
        "authors": [
          "libre-ai"
        ],
        "createdAt": "2026-07-25T00:00:00Z",
        "reviewedAt": "2026-07-25T00:00:00Z"
      },
      "purpose": "Le catalogue canonique verrouille les autorités d'interface — schémas JSON stricts, surfaces OpenAPI, mondes WIT, sources d'autorité Biscuit et politique de rétention — et les types consommés par le code en sont **générés**, une vérification de régénération échouant à la moindre dérive. Les validateurs de frontière rejettent au bord ce que le domaine n'aura donc jamais à défendre. Paquet `packages/contracts` côté TypeScript, `crates/contract-types` côté Rust via construction depuis les schémas. Conséquence pratique : un changement d'interface ne peut pas être silencieux, il casse une gate.",
      "relationships": [
        {
          "status": "accepted",
          "target": "urn:libre-ai:decision:multi-repo-target-topology",
          "type": "governed-by"
        }
      ],
      "schemaVersion": "libre-ai.knowledge-object.v1",
      "status": "accepted",
      "trust": "reviewed"
    },
    {
      "authority": {
        "owners": [
          "libre-ai/architecture"
        ],
        "path": "ecosystem/objects/capabilities/data-subject-rights.json"
      },
      "id": "urn:libre-ai:capability:data-subject-rights",
      "kind": "Capability",
      "name": "Droits des personnes concernées, typés et exerçables",
      "provenance": {
        "authors": [
          "libre-ai"
        ],
        "createdAt": "2026-07-25T00:00:00Z",
        "reviewedAt": "2026-07-25T00:00:00Z"
      },
      "purpose": "Brique transverse `packages/rgpd-kit` exposant les droits d'accès, d'effacement, de limitation et de portabilité derrière un port unique, `DataSubjectRightsPort`. L'identifiant en clair n'apparaît que dans `verifySubject` : au-delà, tout parle en digests opaques dérivés avec séparation de domaine et verrouillés par un vecteur golden. La limitation de l'Article 18 est implémentée en table append-only avec levée en deux temps — demande, notification attestée, puis confirmation — et croise la rétention par une exclusion explicite : un sujet en limitation n'est pas balayé, puisque supprimer est un traitement. Registre des activités et canevas d'analyse d'impact sont générés par la même brique.",
      "relationships": [
        {
          "status": "accepted",
          "target": "urn:libre-ai:capability:executable-retention",
          "type": "depends-on"
        }
      ],
      "schemaVersion": "libre-ai.knowledge-object.v1",
      "status": "accepted",
      "trust": "reviewed"
    },
    {
      "authority": {
        "owners": [
          "libre-ai/architecture"
        ],
        "path": "ecosystem/objects/capabilities/delegated-authorization-biscuit.json"
      },
      "id": "urn:libre-ai:capability:delegated-authorization-biscuit",
      "kind": "Capability",
      "name": "Autorisation déléguée atténuable et révocable",
      "provenance": {
        "authors": [
          "libre-ai"
        ],
        "createdAt": "2026-07-25T00:00:00Z",
        "reviewedAt": "2026-07-25T00:00:00Z"
      },
      "purpose": "Autorisation deny-by-default fondée sur Biscuit : émission d'un jeton d'autorité, atténuation hors ligne par le porteur sans contact avec l'émetteur, révocation par identifiant, et rotation Ed25519 à deux clés permettant d'accepter l'ancienne et la nouvelle pendant la fenêtre de bascule. Les faits de tenant sont obligatoires dans le jeton, ce qui rend l'isolation vérifiable au point d'autorisation et non seulement au stockage. Implémentation Rust `crates/authz-biscuit`, contrats sous `contracts/authz/`. C'est la réponse au problème que les jetons opaques ne résolvent pas : déléguer moins de droits que l'on détient, sans serveur d'autorisation au milieu.",
      "relationships": [
        {
          "status": "accepted",
          "target": "urn:libre-ai:decision:g1-cross-cutting-product-decisions",
          "type": "governed-by"
        }
      ],
      "schemaVersion": "libre-ai.knowledge-object.v1",
      "status": "accepted",
      "trust": "reviewed"
    },
    {
      "authority": {
        "owners": [
          "libre-ai/architecture"
        ],
        "path": "ecosystem/objects/capabilities/deterministic-policy-evaluation.json"
      },
      "id": "urn:libre-ai:capability:deterministic-policy-evaluation",
      "kind": "Capability",
      "name": "Évaluation de politique déterministe et explicable",
      "provenance": {
        "authors": [
          "libre-ai"
        ],
        "createdAt": "2026-07-25T00:00:00Z",
        "reviewedAt": "2026-07-25T00:00:00Z"
      },
      "purpose": "Moteur d'évaluation dont deux implémentations — une référence TypeScript et un moteur Rust compilé en WASM — doivent produire des sorties identiques sur un jeu de vecteurs golden, la conformité étant vérifiée en intégration continue. Le déterminisme repose sur la canonicalisation JSON RFC 8785 et un digest SHA-256, avec un analyseur JSON strict qui refuse ce qu'un analyseur permissif accepterait. Les décisions sont explicables par construction : la règle décidante est nommée dans la sortie. Paquets `packages/policy-core-ref` et `crates/policy-core`. C'est le patron réutilisable pour toute décision automatisée qui doit être contestable.",
      "schemaVersion": "libre-ai.knowledge-object.v1",
      "status": "accepted",
      "trust": "reviewed"
    },
    {
      "authority": {
        "owners": [
          "libre-ai/architecture"
        ],
        "path": "ecosystem/objects/capabilities/device-local-encryption.json"
      },
      "id": "urn:libre-ai:capability:device-local-encryption",
      "kind": "Capability",